{
  "format": "carter-observed-callouts/v1",
  "schema_version": 1,
  "profile_id": "entombed-sentinels-observed-v1",
  "profile_revision": 1,
  "encounter_id": 3445,
  "encounter_name": "Entombed Sentinels",
  "difficulty_ids": [15],
  "boss_creature_ids": [258557, 258558],
  "predictions_enabled": false,
  "mechanics": [
    {
      "mechanic_id": "empowering_slam",
      "name": "Empowering Slam",
      "event_type": "SPELL_CAST_START",
      "spell_id": 1284458,
      "source_policy": {"kind": "creature_allowlist", "creature_ids": [258557]},
      "grouping": {"mode": "leading_edge_batch_window", "window_seconds": 0.0},
      "duplicate_suppression_seconds": 0.25,
      "text": "Empowering Slam. Tank defensive.",
      "audio_key": "entombed_empowering_slam",
      "priority": 95,
      "max_lateness_seconds": 5.0,
      "confidence": 0.95,
      "wording_status": "provisional"
    },
    {
      "mechanic_id": "bloodvenom_injection",
      "name": "Bloodvenom Injection",
      "event_type": "SPELL_CAST_START",
      "spell_id": 1284487,
      "source_policy": {"kind": "creature_allowlist", "creature_ids": [258558]},
      "grouping": {"mode": "leading_edge_batch_window", "window_seconds": 0.0},
      "duplicate_suppression_seconds": 0.25,
      "text": "Bloodvenom Injection. Tank defensive.",
      "audio_key": "entombed_bloodvenom_injection",
      "priority": 95,
      "max_lateness_seconds": 5.0,
      "confidence": 0.95,
      "wording_status": "provisional"
    },
    {
      "mechanic_id": "venom_coagulation",
      "name": "Venom Coagulation",
      "event_type": "SPELL_CAST_START",
      "spell_id": 1284251,
      "source_policy": {"kind": "creature_allowlist", "creature_ids": [258557]},
      "grouping": {"mode": "leading_edge_batch_window", "window_seconds": 0.0},
      "duplicate_suppression_seconds": 0.25,
      "text": "Big adds.",
      "audio_key": "entombed_venom_coagulation",
      "priority": 85,
      "max_lateness_seconds": 5.0,
      "confidence": 0.95,
      "wording_status": "provisional"
    },
    {
      "mechanic_id": "toxic_droplets",
      "name": "Toxic Droplets",
      "event_type": "SPELL_CAST_START",
      "spell_id": 1284434,
      "source_policy": {"kind": "creature_allowlist", "creature_ids": [258557]},
      "grouping": {"mode": "leading_edge_batch_window", "window_seconds": 0.0},
      "duplicate_suppression_seconds": 0.25,
      "text": "Soak orbs.",
      "audio_key": "entombed_toxic_droplets",
      "priority": 90,
      "max_lateness_seconds": 5.0,
      "confidence": 0.95,
      "wording_status": "provisional"
    },
    {
      "mechanic_id": "unstable_miasma",
      "name": "Unstable Miasma",
      "event_type": "SPELL_CAST_START",
      "spell_id": 1288232,
      "source_policy": {"kind": "creature_allowlist", "creature_ids": [258558]},
      "grouping": {"mode": "leading_edge_batch_window", "window_seconds": 0.0},
      "duplicate_suppression_seconds": 0.25,
      "text": "Group soak.",
      "audio_key": "entombed_unstable_miasma",
      "priority": 95,
      "max_lateness_seconds": 5.0,
      "confidence": 0.95,
      "wording_status": "provisional"
    },
    {
      "mechanic_id": "blighted_blood",
      "name": "Blighted Blood",
      "event_type": "SPELL_CAST_START",
      "spell_id": 1284483,
      "source_policy": {"kind": "creature_allowlist", "creature_ids": [258558]},
      "grouping": {"mode": "leading_edge_batch_window", "window_seconds": 0.0},
      "duplicate_suppression_seconds": 0.25,
      "text": "Pool debuffs.",
      "audio_key": "entombed_blighted_blood",
      "priority": 85,
      "max_lateness_seconds": 5.0,
      "confidence": 0.85,
      "wording_status": "provisional"
    },
    {
      "mechanic_id": "vitriolic_stasis",
      "name": "Vitriolic Stasis",
      "event_type": "SPELL_AURA_APPLIED",
      "spell_id": 1284588,
      "source_policy": {"kind": "creature_allowlist", "creature_ids": [258558]},
      "grouping": {"mode": "leading_edge_batch_window", "window_seconds": 0.0},
      "duplicate_suppression_seconds": 0.25,
      "text": "Math puzzle.",
      "audio_key": "entombed_vitriolic_stasis",
      "priority": 90,
      "max_lateness_seconds": 5.0,
      "confidence": 0.9,
      "wording_status": "provisional"
    }
  ]
}
