{
  "format": "carter-observed-callouts/v1",
  "schema_version": 1,
  "profile_id": "nekzali-observed-v1",
  "profile_revision": 1,
  "encounter_id": 3470,
  "encounter_name": "Nek'zali the Soulcoiler",
  "difficulty_ids": [15, 17],
  "boss_creature_ids": [259927],
  "predictions_enabled": false,
  "mechanics": [
    {
      "mechanic_id": "essence_rend",
      "name": "Essence Rend",
      "event_type": "SPELL_AURA_APPLIED",
      "spell_id": 1287427,
      "source_policy": {"kind": "nil_or_zero_guid", "guids": ["0000000000000000", "nil"]},
      "grouping": {"mode": "leading_edge_batch_window", "window_seconds": 0.25},
      "duplicate_suppression_seconds": 0.0,
      "text": "Essence Rend. Watch the lines.",
      "audio_key": "nekzali_essence_rend",
      "priority": 90,
      "max_lateness_seconds": 5.0,
      "confidence": 0.9,
      "wording_status": "provisional"
    },
    {
      "mechanic_id": "possession_barrage",
      "name": "Possession Barrage",
      "event_type": "SPELL_CAST_START",
      "spell_id": 1284103,
      "source_policy": {"kind": "creature_allowlist", "creature_ids": [259927]},
      "grouping": {"mode": "leading_edge_batch_window", "window_seconds": 0.0},
      "duplicate_suppression_seconds": 0.25,
      "text": "Barrage. Avoid the tank line.",
      "audio_key": "nekzali_barrage",
      "priority": 95,
      "max_lateness_seconds": 5.0,
      "confidence": 0.95,
      "wording_status": "provisional"
    },
    {
      "mechanic_id": "restless_amani",
      "name": "Restless Amani",
      "event_type": "SPELL_SUMMON",
      "spell_id": 1290322,
      "source_policy": {"kind": "creature_allowlist", "creature_ids": [259927]},
      "grouping": {"mode": "leading_edge_batch_window", "window_seconds": 5.0},
      "duplicate_suppression_seconds": 0.0,
      "text": "Adds. Switch targets.",
      "audio_key": "nekzali_restless_amani",
      "priority": 85,
      "max_lateness_seconds": 5.0,
      "confidence": 0.9,
      "wording_status": "provisional"
    },
    {
      "mechanic_id": "ritual_of_awakening",
      "name": "Ritual of Awakening",
      "event_type": "SPELL_CAST_START",
      "spell_id": 1295124,
      "source_policy": {"kind": "creature_allowlist", "creature_ids": [259927]},
      "grouping": {"mode": "leading_edge_batch_window", "window_seconds": 0.0},
      "duplicate_suppression_seconds": 0.25,
      "text": "Ritual starting.",
      "audio_key": "nekzali_ritual",
      "priority": 85,
      "max_lateness_seconds": 5.0,
      "confidence": 0.95,
      "wording_status": "provisional"
    },
    {
      "mechanic_id": "hungering_pyre",
      "name": "Hungering Pyre",
      "event_type": "SPELL_CAST_START",
      "spell_id": 1289855,
      "source_policy": {"kind": "creature_allowlist", "creature_ids": [263050]},
      "grouping": {"mode": "leading_edge_batch_window", "window_seconds": 0.0},
      "duplicate_suppression_seconds": 0.25,
      "text": "Group soak.",
      "audio_key": "nekzali_hungering_pyre",
      "priority": 95,
      "max_lateness_seconds": 5.0,
      "confidence": 0.95,
      "wording_status": "provisional"
    },
    {
      "mechanic_id": "uncoiling",
      "name": "Uncoiling",
      "event_type": "SPELL_AURA_APPLIED",
      "spell_id": 1290003,
      "source_policy": {"kind": "creature_allowlist", "creature_ids": [259927]},
      "grouping": {"mode": "leading_edge_batch_window", "window_seconds": 0.0},
      "duplicate_suppression_seconds": 0.25,
      "text": "Uncoiling.",
      "audio_key": "nekzali_uncoiling",
      "priority": 100,
      "max_lateness_seconds": 5.0,
      "confidence": 0.75,
      "wording_status": "provisional"
    },
    {
      "mechanic_id": "invoke",
      "name": "Invoke",
      "event_type": "SPELL_CAST_START",
      "spell_id": 1299673,
      "source_policy": {"kind": "creature_allowlist", "creature_ids": [259927]},
      "grouping": {"mode": "leading_edge_batch_window", "window_seconds": 0.0},
      "duplicate_suppression_seconds": 0.25,
      "text": "Invoke.",
      "audio_key": "nekzali_invoke",
      "priority": 90,
      "max_lateness_seconds": 5.0,
      "confidence": 0.95,
      "wording_status": "provisional"
    }
  ]
}
